Crypto Bros make my timeline unbearable; always ruining everything. When will it stop?
Wish campers would stay away from this app. This keeps happening. #s5iy1
Gen Z make the meeting unbearable; always harassing people. When will it stop? #uju2
Keep crypto bros out of the internet—enough is enough. When will it stop? #cmz3
Keep loud neighbors out of the stadium—enough is enough. Tired of pretending it's fine. #18f4
Why are streamers everywhere in our neighborhood? Not welcome. Nobody wants this. #m3r25
"Every time campers show up in our neighborhood, chaos follows. Nobody wants this. #pet36"
Spoilers again in the parking lot. Spare us. Do something about it.
Spam Bots make the queue unbearable; always making things worse.
Spam Bots make the office unbearable; always making things worse. When will it stop?
Had it with lawyers in the parking lot; constantly bragging non-stop. When will it stop?
Why are line cutters everywhere in the subway? Not welcome.
Had it with gen z in the queue; constantly being toxic.
The Forum was fine until scalpers started bragging non-stop. This keeps happening. #o4je13
The Stadium was fine until streamers started starting drama. Nobody wants this. #1flc14
Wish scalpers would stay away from the forum. This keeps happening.
Wish crypto bros would stay away from the queue. Do something about it. #b2q16
Cheaters again in the subway. Spare us. Tired of pretending it's fine. #yuu17
Had it with loud neighbors in the store; constantly cheating the system. Tired of pretending it's fine. #s6q18
Keep streamers out of the subway—enough is enough. Nobody wants this.
Gen Z again in the parking lot. Spare us. Do something about it.
Wish lawyers would stay away from our neighborhood. Do something about it. #78f21
Please stop letting gamers into the internet. Tired of pretending it's fine. #v4bc22
This City was fine until bandwagon fans started cheating the system. #lwh23
Tourists again in this app. Spare us. Nobody wants this. #xy2524
Why are cheaters everywhere in the subway? Not welcome. #xhh25
Keep streamers out of the classroom—enough is enough. When will it stop? #o2ia26
"Every time cheaters show up in the office, chaos follows. When will it stop? #ngk427"
Keep gamers out of this app—enough is enough. When will it stop? #40m028
This App was fine until litterers started cheating the system. Nobody wants this. #2ndy29
Wish cheaters would stay away from our neighborhood. Nobody wants this. #j9co30
"Every time litterers show up in the subway, chaos follows. This keeps happening. #q87d31"
Why are gen z everywhere in my timeline? Not welcome. When will it stop?
Politicians again in this city. Spare us. Nobody wants this. #puyn33
The Office was fine until tourists started cheating the system. Tired of pretending it's fine. #vf7g34
"Every time campers show up in this app, chaos follows. Tired of pretending it's fine. #s3p35"
Keep gamers out of the forum—enough is enough. This keeps happening. #wh7a36
Gen Z make the store unbearable; always baiting arguments. #5n2i37
"Every time litterers show up in the subway, chaos follows. Nobody wants this. #12sf38"
Why are bandwagon fans everywhere in our neighborhood? Not welcome. Tired of pretending it's fine.
Why are line cutters everywhere in the office? Not welcome.
Had it with streamers in our neighborhood; constantly breaking the rules. This keeps happening. #0wys41
"Every time vegans show up in the classroom, chaos follows."
The Internet was fine until cheaters started spamming constantly. When will it stop? #vaze43
Please stop letting cheaters into the parking lot. Nobody wants this.
Had it with trolls in the queue; constantly being toxic.
Wish tourists would stay away from this city. #4rck46
Why are crypto bros everywhere in our neighborhood? Not welcome. Nobody wants this. #xl647
Gamers again in the store. Spare us. Do something about it. #0ra48
The Store was fine until cheaters started breaking the rules. Tired of pretending it's fine.
The Subway was fine until litterers started harassing people. When will it stop? #9gs50
Wish spam bots would stay away from the store. Tired of pretending it's fine.
Wish campers would stay away from the stadium. Do something about it.
This City was fine until campers started harassing people. Do something about it. #mt053
Gen Z again in my timeline. Spare us. When will it stop? #vww54
Trolls = problems in the classroom. I'm over it. Nobody wants this.
Gamers = problems in this city. I'm over it. When will it stop? #8pma3
The Internet was fine until vegans started being toxic. When will it stop?
The Forum was fine until cheaters started starting drama. Tired of pretending it's fine. #jm858
Our Neighborhood was fine until scalpers started being toxic. Do something about it.
Had it with tourists in the internet; constantly ruining everything. When will it stop?
Wish spoilers would stay away from the forum. Do something about it. #mh8l8
Please stop letting campers into the subway. Tired of pretending it's fine. #j7vq9
Why are vegans everywhere in the internet? Not welcome. #42en10
Had it with bandwagon fans in the meeting; constantly starting drama. Tired of pretending it's fine. #e0f311
Gamers again in the forum. Spare us. Tired of pretending it's fine. #rx4c12
Please stop letting vegans into the forum. When will it stop? #5nku13
This City was fine until line cutters started spamming constantly. When will it stop? #18d67
Drivers = problems in my timeline. I'm over it. #hlj615
Wish scalpers would stay away from the classroom. This keeps happening. #wonx16
Why are scalpers everywhere in the office? Not welcome. This keeps happening. #2lm117
Gen Z again in the queue. Spare us. Do something about it. #p3z71
Had it with bandwagon fans in the parking lot; constantly ruining everything. Do something about it. #ccnz19
Keep boomers out of the classroom—enough is enough. Do something about it.
Lawyers make the office unbearable; always starting drama. #mrwb21
Had it with loud neighbors in the subway; constantly baiting arguments. This keeps happening. #6txq22
The Store was fine until bandwagon fans started ruining everything. #vog76
Had it with politicians in the office; constantly ruining everything. Do something about it.
Wish gen z would stay away from my timeline. #6hlv25
"Every time boomers show up in this city, chaos follows. Nobody wants this."
The Classroom was fine until cheaters started bragging non-stop. Tired of pretending it's fine. #r4j80
Wish streamers would stay away from the forum. When will it stop?
Had it with politicians in the internet; constantly ruining everything.
Why are vegans everywhere in the meeting? Not welcome. Do something about it. #5rs730
Tourists again in the stadium. Spare us. This keeps happening.
Gen Z = problems in the parking lot. I'm over it. Nobody wants this. #ry2k32
"Every time lawyers show up in this city, chaos follows. When will it stop? #l5f86"
"Every time lawyers show up in this app, chaos follows. #3zcu34"
Why are scalpers everywhere in the stadium? Not welcome. Do something about it. #ge788
Boomers again in the meeting. Spare us. Nobody wants this. #1tpe36
Wish gamers would stay away from our neighborhood. Tired of pretending it's fine. #mie90
Campers make the internet unbearable; always breaking the rules. Tired of pretending it's fine. #ooi91
Wish bandwagon fans would stay away from the office. Tired of pretending it's fine. #poo92
Politicians make the store unbearable; always ruining everything. Nobody wants this.
Why are tourists everywhere in the subway? Not welcome. Nobody wants this. #qd194
Keep trolls out of the internet—enough is enough. This keeps happening. #5z195
Had it with boomers in our neighborhood; constantly harassing people. #ocjw43
Spoilers make the queue unbearable; always being toxic.
The Meeting was fine until trolls started bragging non-stop. Nobody wants this. #vpk1
Gen Z = problems in the internet. I'm over it. When will it stop?
"Every time lawyers show up in the store, chaos follows. This keeps happening. #j8k547"
Wish trolls would stay away from my timeline. Tired of pretending it's fine. #0wvy48
Our Neighborhood was fine until line cutters started spamming constantly. When will it stop?
Keep crypto bros out of the stadium—enough is enough. Do something about it.
"Every time bandwagon fans show up in the stadium, chaos follows. Tired of pretending it's fine. #o4lg51"
Tourists again in the office. Spare us. When will it stop? #1k5s52
The Queue was fine until gamers started starting drama. Do something about it. #ea1c0
Keep cheaters out of the internet—enough is enough. #kwt10
Please stop letting bandwagon fans into the forum. Do something about it. #j6311
"Every time scalpers show up in the forum, chaos follows. When will it stop?"
Please stop letting gamers into the queue. Nobody wants this. #xcw13
The Meeting was fine until spoilers started talking over everyone. This keeps happening. #vxp14
Wish spoilers would stay away from the queue. This keeps happening.
Had it with vegans in the queue; constantly being toxic. Tired of pretending it's fine. #4k316
Streamers = problems in this city. I'm over it.
Line Cutters = problems in the subway. I'm over it. This keeps happening. #3fq18
Keep crypto bros out of the classroom—enough is enough. This keeps happening. #qsp19
Line Cutters again in the forum. Spare us. When will it stop?
The Store was fine until boomers started breaking the rules. Do something about it.
"Every time boomers show up in this app, chaos follows. Do something about it."
"Every time gen z show up in my timeline, chaos follows. When will it stop? #6hk414"
Why are lawyers everywhere in our neighborhood? Not welcome. Do something about it. #rpif15
"Every time bandwagon fans show up in the forum, chaos follows. This keeps happening."
Keep loud neighbors out of my timeline—enough is enough. Do something about it. #hnf317
Campers make the stadium unbearable; always making things worse. Nobody wants this.
Streamers = problems in the forum. I'm over it. When will it stop? #xd5p19
Streamers again in the queue. Spare us. This keeps happening. #flh29
Cheaters = problems in the office. I'm over it. Nobody wants this. #k2230
Keep boomers out of the parking lot—enough is enough.
Please stop letting crypto bros into the subway. When will it stop? #2y9e23
This City was fine until streamers started talking over everyone. When will it stop?
Keep bandwagon fans out of this app—enough is enough. #muwj25
Gen Z make the internet unbearable; always starting drama. Tired of pretending it's fine.
Scalpers make this city unbearable; always ruining everything. Nobody wants this. #nh736
Why are politicians everywhere in the office? Not welcome. Tired of pretending it's fine. #aqz37
Please stop letting line cutters into the classroom. Tired of pretending it's fine. #xvdk29
Line Cutters again in the forum. Spare us. Tired of pretending it's fine. #8ck39
Had it with lawyers in the forum; constantly cheating the system. Tired of pretending it's fine. #sn840
Keep campers out of the meeting—enough is enough. #3vme32
Loud Neighbors make the meeting unbearable; always harassing people. Do something about it. #yk842
Vegans = problems in the store. I'm over it. Nobody wants this.
Campers make the queue unbearable; always not respecting others. Do something about it.
Tourists = problems in the stadium. I'm over it. #43y45
Had it with vegans in the meeting; constantly breaking the rules. Nobody wants this. #dc446
"Every time vegans show up in the internet, chaos follows. When will it stop? #o1e47"
Please stop letting lawyers into the store. When will it stop?
The Classroom was fine until scalpers started starting drama. When will it stop? #uap940
The Queue was fine until bandwagon fans started starting drama. Do something about it. #zfte41
Spam Bots = problems in the subway. I'm over it. This keeps happening. #tary42
The Forum was fine until campers started harassing people. Do something about it. #wohf43
"Every time gen z show up in the store, chaos follows. This keeps happening."
Wish spam bots would stay away from the store. Nobody wants this. #lf454
Please stop letting loud neighbors into the meeting. This keeps happening.
Keep boomers out of the meeting—enough is enough. #enx56
"Every time spam bots show up in the internet, chaos follows. Tired of pretending it's fine. #bt557"
Streamers again in the forum. Spare us. When will it stop?
Politicians again in the parking lot. Spare us. This keeps happening. #6jw59
Had it with scalpers in this city; constantly talking over everyone. Nobody wants this.
Why are crypto bros everywhere in the parking lot? Not welcome. This keeps happening. #hjw61
Spoilers make the store unbearable; always starting drama. Tired of pretending it's fine.
Keep boomers out of this app—enough is enough. #lovh1
Vegans make the meeting unbearable; always ruining everything. Do something about it. #2yl64
Please stop letting line cutters into this app. #pzdp3
"Every time gamers show up in the office, chaos follows. Nobody wants this. #ovi66"
Keep spoilers out of the store—enough is enough. Do something about it.
Keep crypto bros out of the classroom—enough is enough. Do something about it.
"Every time cheaters show up in the queue, chaos follows. When will it stop? #i6g69"
"Every time spoilers show up in the subway, chaos follows. Tired of pretending it's fine. #esc18"
Why are loud neighbors everywhere in this city? Not welcome.
Cheaters = problems in the forum. I'm over it. Nobody wants this. #uiy72
Why are litterers everywhere in the queue? Not welcome. This keeps happening.
Why are tourists everywhere in my timeline? Not welcome. Tired of pretending it's fine. #0u3712
Please stop letting bandwagon fans into our neighborhood. When will it stop? #p3mg13
Had it with streamers in the classroom; constantly spamming constantly. Do something about it. #8un76
Wish cheaters would stay away from the store. When will it stop?
The Meeting was fine until crypto bros started bragging non-stop. This keeps happening. #vvr78
Crypto Bros = problems in my timeline. I'm over it. This keeps happening.
The Forum was fine until crypto bros started spamming constantly.
Wish loud neighbors would stay away from our neighborhood. Nobody wants this. #lvwy19
Wish trolls would stay away from this app.
Spoilers = problems in the internet. I'm over it. Tired of pretending it's fine. #ot483
Crypto Bros make my timeline unbearable; always harassing people.
Had it with streamers in our neighborhood; constantly bragging non-stop. Do something about it.
Lawyers make the forum unbearable; always starting drama. When will it stop? #kxs86
This City was fine until lawyers started not respecting others. Do something about it. #yntd25
Loud Neighbors again in the office. Spare us. Tired of pretending it's fine.
The Internet was fine until bandwagon fans started starting drama. When will it stop?
Spam Bots = problems in this city. I'm over it. When will it stop?
Had it with trolls in this app; constantly making things worse. #f6xo29
"Every time bandwagon fans show up in the office, chaos follows. Tired of pretending it's fine. #6g4d30"
The Stadium was fine until bandwagon fans started bragging non-stop. When will it stop? #xqb831
Our Neighborhood was fine until tourists started bragging non-stop. Do something about it. #kba94
This App was fine until boomers started baiting arguments. Tired of pretending it's fine.
Litterers again in our neighborhood. Spare us. #09q96
The Office was fine until tourists started being toxic. Nobody wants this. #n270
"Every time cheaters show up in the parking lot, chaos follows. When will it stop? #i0i1"
Keep cheaters out of the internet—enough is enough. Do something about it.
Gen Z again in the office. Spare us. Nobody wants this. #2nq3
Had it with scalpers in my timeline; constantly talking over everyone. Nobody wants this.
Had it with campers in the classroom; constantly bragging non-stop. Do something about it. #ez2k40
Keep spoilers out of the meeting—enough is enough. Nobody wants this.
Keep campers out of the forum—enough is enough. Do something about it.
"Every time bandwagon fans show up in the store, chaos follows. Tired of pretending it's fine. #1iwa43"
Had it with litterers in the stadium; constantly ruining everything. Tired of pretending it's fine. #qwx9
Had it with drivers in the forum; constantly bragging non-stop. When will it stop?
Wish spam bots would stay away from the meeting. When will it stop? #q24a46
Please stop letting line cutters into the internet.
Campers make this app unbearable; always breaking the rules. This keeps happening. #trf13
Politicians = problems in the internet. I'm over it. Tired of pretending it's fine.
Scalpers make the forum unbearable; always cheating the system. This keeps happening.
Line Cutters again in the queue. Spare us. Tired of pretending it's fine.
The Internet was fine until spam bots started spamming constantly. Nobody wants this. #h8517
The Classroom was fine until drivers started ruining everything. Do something about it. #mhgl0
Lawyers = problems in the office. I'm over it. Tired of pretending it's fine. #s9ps1
Please stop letting loud neighbors into our neighborhood. Tired of pretending it's fine. #exdc2
Why are spoilers everywhere in our neighborhood? Not welcome. When will it stop? #zbf21
Why are bandwagon fans everywhere in the classroom? Not welcome. Do something about it. #9d8m4
Streamers make our neighborhood unbearable; always making things worse. Do something about it. #23a23
Why are gen z everywhere in this city? Not welcome. When will it stop? #38424
"Every time boomers show up in the forum, chaos follows. Nobody wants this. #ornk7"
Please stop letting gamers into this app. When will it stop? #8li26
Had it with politicians in the classroom; constantly harassing people. This keeps happening. #17827
Lawyers = problems in the meeting. I'm over it. Nobody wants this. #8tu110
Wish gen z would stay away from the forum. This keeps happening. #urao11
Streamers = problems in my timeline. I'm over it. Tired of pretending it's fine.
Why are trolls everywhere in the forum? Not welcome.
Why are drivers everywhere in the stadium? Not welcome. Nobody wants this. #5uj32
"Every time vegans show up in the store, chaos follows. Do something about it."
Had it with spam bots in the classroom; constantly bragging non-stop.
"Every time bandwagon fans show up in the store, chaos follows."
"Every time gen z show up in the classroom, chaos follows. Nobody wants this. #7md36"
Gamers again in the office. Spare us. #x3b37
Trolls = problems in the subway. I'm over it. Nobody wants this.
Keep scalpers out of this city—enough is enough. Tired of pretending it's fine. #c36d21
Why are trolls everywhere in the subway? Not welcome. Nobody wants this. #adw40
Drivers again in the stadium. Spare us. Do something about it. #sn4i23
Why are drivers everywhere in the internet? Not welcome. Nobody wants this. #fet42
Crypto Bros = problems in the queue. I'm over it. Tired of pretending it's fine. #l8ll25
The Subway was fine until drivers started making things worse. Do something about it.
Keep boomers out of the forum—enough is enough. When will it stop? #7qw827
"Every time streamers show up in the queue, chaos follows. This keeps happening. #al446"
Had it with boomers in our neighborhood; constantly not respecting others. #ucj729
"Every time politicians show up in the meeting, chaos follows. Tired of pretending it's fine. #04b48"
Wish spam bots would stay away from the stadium. When will it stop?
Why are streamers everywhere in this app? Not welcome. #hle50
Why are line cutters everywhere in the office? Not welcome. Tired of pretending it's fine. #zvqz33
Wish campers would stay away from the meeting.
Keep vegans out of my timeline—enough is enough. This keeps happening.
Why are spam bots everywhere in the parking lot? Not welcome. Tired of pretending it's fine. #b4op36
"Every time spoilers show up in the parking lot, chaos follows. When will it stop? #qcq55"
Keep spam bots out of my timeline—enough is enough. This keeps happening. #9mav38
Keep crypto bros out of the queue—enough is enough. This keeps happening. #y8857
Had it with politicians in the meeting; constantly talking over everyone. This keeps happening. #gdff40
"Every time scalpers show up in the stadium, chaos follows. Nobody wants this."
Why are politicians everywhere in the stadium? Not welcome. Nobody wants this. #u4b60
Drivers make the parking lot unbearable; always baiting arguments. Nobody wants this.
Had it with tourists in this city; constantly talking over everyone. This keeps happening.
Trolls = problems in this app. I'm over it. When will it stop?
Why are litterers everywhere in the queue? Not welcome. This keeps happening.
Why are boomers everywhere in the meeting? Not welcome. Nobody wants this. #3a365
Campers = problems in the meeting. I'm over it. #iau66
This City was fine until streamers started starting drama. Tired of pretending it's fine.
Litterers again in the office. Spare us. Tired of pretending it's fine. #l95c50
Had it with line cutters in this city; constantly breaking the rules. Tired of pretending it's fine. #ztht51
Bandwagon Fans make this app unbearable; always making things worse. This keeps happening. #rfl70
"Every time tourists show up in the office, chaos follows. Nobody wants this."
Litterers again in the parking lot. Spare us. Do something about it. #9rxm1
Keep crypto bros out of the classroom—enough is enough. Nobody wants this. #kk173
Please stop letting loud neighbors into my timeline. Do something about it.
Why are vegans everywhere in my timeline? Not welcome. Do something about it. #5nlr4
The Subway was fine until vegans started being toxic. This keeps happening. #28e76
Wish line cutters would stay away from my timeline. When will it stop?
"Every time crypto bros show up in the internet, chaos follows. When will it stop? #rd978"
"Every time streamers show up in the stadium, chaos follows. When will it stop? #00m79"
Lawyers make the subway unbearable; always bragging non-stop. When will it stop?
Why are boomers everywhere in the store? Not welcome.
Had it with scalpers in my timeline; constantly starting drama. #e5x82
"Every time crypto bros show up in the parking lot, chaos follows. When will it stop? #qxg83"
Had it with trolls in this city; constantly baiting arguments. When will it stop?
Please stop letting spoilers into the store. Nobody wants this.
"Every time politicians show up in the parking lot, chaos follows. This keeps happening. #4gx015"
Please stop letting scalpers into the meeting. This keeps happening. #uu387
The Internet was fine until litterers started starting drama. Tired of pretending it's fine. #3ji88
Tourists make this app unbearable; always starting drama. Do something about it. #904h18
Please stop letting politicians into this app. This keeps happening.
Wish tourists would stay away from this app. Nobody wants this.
Keep streamers out of the meeting—enough is enough. When will it stop? #1q0x21
Gamers make the subway unbearable; always spamming constantly. Do something about it. #izi93
Wish loud neighbors would stay away from the office. Do something about it.
Scalpers again in the internet. Spare us. Do something about it. #58v95
Please stop letting spam bots into our neighborhood. When will it stop?
Lawyers = problems in the internet. I'm over it. Nobody wants this. #86l0
Keep drivers out of the meeting—enough is enough. Nobody wants this. #hc9l27
Had it with line cutters in the store; constantly spamming constantly. #kwp528
Gen Z make this city unbearable; always making things worse. Tired of pretending it's fine. #ahin29
Wish scalpers would stay away from the store. When will it stop? #lb54
Please stop letting tourists into our neighborhood. When will it stop? #g7fy31
Had it with litterers in the stadium; constantly ruining everything. Do something about it. #qvdo32
Scalpers again in the internet. Spare us. #7oak33
Had it with line cutters in this city; constantly cheating the system. When will it stop?
